date,headline
2025-06-15,Gemini AI To Steal the Show at Samsung's Z Fold 7 & Flip 7 Launch
2025-06-15,Samsung Galaxy A15 64GB Prepaid Smartphone for Straight Talk for $40 + free shipping
2025-06-15,Top 10 trending phones of week 24
2025-06-15,2000 Country Coach Kensington Prevost H3-45 Motorhome
2025-06-15,How to watch Costa Rica vs Suriname in the USA: Live Stream and TV for 2025 Gold Cup
2025-06-15,How to watch Botafogo vs Seattle Sounders in the USA: Live Stream and TV for FIFA Club World Cup 2025
2025-06-15,Here is a list of Samsung Galaxy watches that won't be supported after September 2025
2025-06-15,How to watch Haiti vs Saudi Arabia in the USA: Live Stream and TV for 2025 Gold Cup
2025-06-15,"Amazon is selling a 'brilliant' $36 portable charger for $21, and shoppers say it 'offers incredible convenience'"
2025-06-15,Review: OnePlus Pad 3
2025-06-15,Why June is a bad month to buy certain Samsung products
2025-06-15,Material 3 Expressive brings what I love about Android into the modern day
2025-06-15,How to watch USA vs Trinidad and Tobago in the USA: Live Stream and TV for 2025 Gold Cup
2025-06-15,How to watch Palmeiras vs Porto in the USA: Live Stream and TV for FIFA Club World Cup 2025
2025-06-15,Softbank and Intel want to rival Samsung and SK Hynix with HBM memory alternative but I don't think they will succeed - Here's why
2025-06-15,The enormous 49-inch Samsung Odyssey OLED G9 is under $1K again
2025-06-15,Feel Old Yet? You Can Now Emulate PS3 Games on Android Phones
2025-06-15,Feel Old Yet? You Can Now Emulate PS3 Games on Android Phones
2025-06-15,"MSI Officially Rolls Out AMD AGESA 1.2.0.3e BIOS, Supporting 64GB x4 DRAM Configuration And “New” Ryzen CPU"
2025-06-15,Actress Bisola Aiyeola’s Daughter’s Reaction to Getting iPhone on 16th Birthday Trends: “Grateful”
2025-06-15,How to watch PSG vs Atletico Madrid in the USA: Live Stream and TV for FIFA Club World Cup 2025
2025-06-15,"Get Samsung Galaxy S24 Ultra under Rs 55,000 on Amazon"
2025-06-15,Samsung Galaxy A16 5G review: Focusing on what matters
2025-06-15,"I tested Samsung’s unique ‘two-way’ Dolby Atmos soundbar, and it sounds great in both setups"
2025-06-15,Creative environment: Biophilia is a branding imperative
2025-06-15,"9to5Toys News Weekly recap – Switch 2 gear and updates, Splatoon Raiders, next-gen QuietComfort Ultra buds, more"
2025-06-15,"Deals: Pixel 9 is $250 off, 9 Pro XL is $300 off, Sony WH-1000XM6 headphones get first promo"
2025-06-15,Canada’s second-largest airline WestJet is containing a cyberattack
2025-06-15,Auto Accessory Deals at eBay: Up to 95% off + free shipping
2025-06-15,I test tablets for a living and this is the Samsung tablet I recommend the most
2025-06-15,The Moto G Stylus (2025) is finally a budget Motorola phone for power users
2025-06-15,Back Up Camera for 2011-2013 Jeep Grand Cherokee Dodge Durango for $17 + free shipping
2025-06-15,Best of Tech Deals at eBay: Up to 85% off + free shipping
2025-06-15,New Android 16 features you should know
2025-06-15,How to watch Bayern vs Auckland City in the USA: Live Stream and TV for 2025 Club World Cup
2025-06-15,Samsung 9100 Pro SSD
2025-06-15,Samsung 9100 Pro SSD
2025-06-15,SECURITY AFFAIRS MALWARE NEWSLETTER ROUND 49
2025-06-15,Best Buy will give you a free Sony 65-inch 4K TV right now - how to qualify for the deal
2025-06-15,Refurb Phone and Smartwatch Deals at eBay: Up to 83% off + free shipping
2025-06-15,Refurb Phone and Smartwatch Deals at eBay: Up to 83% off + free shipping
2025-06-15,"What’s new in the wearable world of smart glasses, and extended and augmented reality"
2025-06-15,"Galaxy Z Fold 7 Leak Shows Bigger Camera Bump, Slimmer Body"
2025-06-15,Samsung Reportedly Exploring The Use Chinese Materials For OLED Technology As Rising Cost Of 2nm Chipsets May Force A Budget Makeover; Galaxy S26 Series Could Be A Recipient
2025-06-15,"Silicon Motion MonTitan SSD can be rewritten over almost 2000 times but I fear that in the battle against NAND vendors like Samsung, it's just too little too late"
2025-06-15,CryptoClipper Incident - Need Help Identifying and Resolving
2025-06-15,CryptoClipper Incident - Need Help Identifying and Resolving
2025-06-15,Security Affairs newsletter Round 528 by Pierluigi Paganini – INTERNATIONAL EDITION
2025-06-15,CryptoClipper Incident - Need Help Identifying and Resolving
2025-06-15,Massive Samsung One UI 7.0 Update Rolls Out!
2025-06-15,Samsung Galaxy S24 Ultra and Galaxy S24 Price Lowered on Amazon
2025-06-15,Apple's noise-cancelling Beats Fit Pro are simply irresistible at this huge new discount
2025-06-15,Samsung's 32-inch color ePaper display lasts 200 days per charge
2025-06-15,"I haven't even worn the Garmin Venu X1 yet, but it's already telling me a lot about how the company is changing"
2025-06-15,Why Apple is 2025’s worst-performing Big Tech stock
2025-06-15,"TSMC market share rises to 68% in Q1, extending global foundry lead"
2025-06-15,Samsung Galaxy S25+ Powers Van Gogh Museum’s New Audio Tour
2025-06-15,Connected by Gaming: Samsung Unites Global Fans To Celebrate New Era in Gaming Monitors With Odyssey
2025-06-14,"Best of AWE 2025: The most promising XR gadgets from Niantic, Sony, Android XR, and more"
2025-06-14,How to watch Mexico vs Dominican Republic in the USA: Live Stream and TV for 2025 Gold Cup
2025-06-14,How to watch Al Ahly vs Inter Miami in the USA: Live Stream and TV for 2025 Club World Cup
2025-06-14,How to watch Club World Cup in the USA: Live Stream and TV for Opening Ceremony
2025-06-14,I Use This DNS Trick to Access More Content on My Smart TV
2025-06-14,New paperwhite thumb nails not showing
2025-06-14,How to watch Gold Cup 2025 in the USA: Live Stream and TV for Opening Ceremony
2025-06-14,Certified Refurb Samsung Galaxy S24 Android Smartphones: Up to $617 off w/ trade-in + free shipping
2025-06-14,Certified Refurb Samsung Galaxy S24 Android Smartphones: Up to $617 off w/ trade-in + free shipping
2025-06-14,I've used the Google Pixel 9 as my daily driver for nearly a year and I have thoughts
2025-06-14,Google Messages link and image share bug crashes the beta app
2025-06-14,"At $246 off, the Galaxy Watch Ultra offers even more value than usual"
2025-06-14,"This Android app can make your virtual life a little bit easier, if you have patience"
2025-06-14,Samsung Galaxy Z Fold 7 Retail Leak Confirms Ultra-Thin Design
2025-06-14,Europe Makes Its Move in the Chip Race as France’s President Macron Now Hopes To Convince TSMC/Samsung To Set Up Cutting-Edge Facilities
2025-06-14,Samsung Galaxy Tab S10 FE 10.9â Wi-Fi Tablet 128GB â Includes S Pen and Book Cover Keyboard $499.99 (1 replies)
2025-06-14,"Nearly all Indian iPhone models shipped Stateside, Apple lobbies airport authorities"
2025-06-14,Scosche BoomBottle speaker review – Cupholder tunes for your golf cart
2025-06-14,Xiaomi’s Next Display Breakthrough: 2K Real RGB OLED Panels Coming Soon
2025-06-14,"Google reschedules that exclusive Pixel 10 Superfans event , and it's not clear why"
2025-06-14,From Bugs to Brilliance: The Real Story of the OnePlus 13 (after six months)
2025-06-14,Samsung considering Chinese suppliers for OLED displays
2025-06-14,"Deals: Galaxy S24 FE and A56 promo offers discounts, cashback and a free Galaxy Watch7"
2025-06-14,The Samsung Galaxy Buds 3 Pro are an absolute steal right now
2025-06-14,"Best of 9to5Toys – All of this week’s best deals: AirPods Pro 2, Google TV Streamer 4K, REI, more"
2025-06-14,These are the niche features I wish Samsung Good Lock also let me customize
2025-06-14,"News Weekly: Android 16 finally arrives, Samsung teases its Galaxy Z Fold 7, Galaxy Watch 8 leaks keep coming, and more."
2025-06-14,Samsung’s terrible new battery icon proves Apple made the right call with Liquid Glass
2025-06-14,Google Battery Warning Made Worse By Pixel Trade-In Problems
2025-06-14,"$1979 Samsung EPP 65"" OLED S85F 4K Samsung Vision AI Smart TV"
2025-06-14,Here's When Samsung Might Launch the Galaxy Z Fold 7 and Z Flip 7
2025-06-14,I tested the virtually unknown AI app that might take over your Galaxy lock screen
2025-06-14,Best Buy Canada: Daily Deals + Father’s Day Gifts + More
2025-06-14,Your Galaxy Watch could save your life: real-time earthquake alerts now buzz your wrist before tremors hit
2025-06-14,New Samsung Galaxy Z Fold 7 image leaks hint at a thin frame and a big camera bump
2025-06-14,"Hitchins vs. Kambosos Start Time, PPV Fight Card Details"
2025-06-14,My Pixel's lock screen was telling everyone my business until I tweaked this setting
2025-06-14,[eBay Plus] Samsung Galaxy SmartTag2 White $25.74 Delivered @ Sydney Mobiles eBay
2025-06-14,5 reasons why buying the latest flagship is not always a good idea
2025-06-14,T-Mobile will give you the Samsung Galaxy S25 Plus for free - how the deal works
2025-06-14,Why I recommend this Samsung Galaxy Watch over competing Androids - especially at this price
2025-06-14,WWDC Didn't Excite Me. I Really Need the iPhone 17 to Make a Splash
