date,headline,company
2025-06-24,UK may require Google to give users alternative search options and rank its results 'more fairly' - TechCrunch,Google
2025-06-24,New Android 14 update for Chromecast with Google TV rolling out - 9to5Google,Google
2025-06-24,"Google Phone’s M3 Expressive update redesigns bottom bar with Home, Keypad tabs - 9to5Google",Google
2025-06-24,"Scale AI exposed sensitive data about clients like Meta and xAI in public Google Docs, BI finds - Business Insider",Google
2025-06-18,"Search Live: Talk, listen and explore in real time with AI Mode - Google Blog",Google
2025-06-24,Google Earth adds old Street View captures to rewind time from the street level - The Verge,Google
2025-06-24,"Google Earth turns 20, adding historical Street View imagery - 9to5Google",Google
2025-06-24,"OpenAI Quietly Designed a Rival to Google Workspace, Microsoft Office - The Information",Google
2025-06-18,New Maps updates to help you get around Europe more sustainably - Google Blog,Google
2025-06-24,Google Reportedly Taking 4% Stake In Gentle Monster To Take On Ray-Ban Meta - UploadVR,Google
2025-06-24,Verizon adopts Google’s Gemini AI to help customers solve ‘complex’ issues - The Verge,Google
2025-06-24,Spanish mathematician Javier Gómez Serrano and Google DeepMind team up to solve the Navier-Stokes million-dollar problem - EL PAÍS English,Google
2025-06-23,Google’s Android XR glasses are called ‘Martha’ in Pixel Watch-like companion app - 9to5Google,Google
2025-06-23,Google Confirms Most Gmail Users Must Upgrade All Their Accounts - Forbes,Google
2025-06-23,What’s new in Android’s June 2025 Google System Updates [U: 6/23] - 9to5Google,Google
2025-06-24,"Google faces UK crackdown over AI Search, advertising practices - Search Engine Land",Google
2025-06-24,Google Earth just turned 20 – and it’s got a new Street View upgrade to send you down another rabbit hole - TechRadar,Google
2025-06-24,Google Suddenly Raises Trade-In Prices In Rare New Offer - Forbes,Google
2025-06-24,Google faces UK clampdown as watchdog floats market power rules - theregister.com,Google
2025-06-23,"Google Pixel Camera 9.9 rolls out: Social Share removed, icon tweaks - 9to5Google",Google
2025-06-24,"Photo-Stealing Spyware Sneaks Into Apple App Store, Google Play - SecurityWeek",Google
2025-06-24,Google quietly trims Google TV budget to double down on something bigger - PhoneArena,Google
2025-06-21,US v. Google: all the news from the search antitrust showdown - The Verge,Google
2025-06-24,"Google Turbocharges Chromebook Plus With AI Tricks, Lenovo Pounces - HotHardware",Google
2025-06-20,Turkish competition authority launches probe into Google's PMAX - Reuters,Google
2025-06-24,Google Earth turns 20 with a blast from the past and a fresh dose of AI insights - Android Central,Google
2025-06-24,"Do Not Use This Network On Your Phone, Warns Google - Forbes",Google
2025-06-24,Google Is Taking on Pinterest With a New Personalized Image Feed - How-To Geek,Google
2025-06-24,Google Stock (GOOGL) Defies British Competition Crackdown Threats - TipRanks,Google
2025-06-10,Android 16 is here - Google Blog,Google
2025-06-24,AI Impact Summit 2025: Google Cloud COO Says AI Puts a Premium on Curiosity - Newsweek,Google
2025-06-19,Google faces setback as EU court adviser backs antitrust regulators - Reuters,Google
2025-06-24,I use 4 Google apps daily. A super app would fix everything - Android Police,Google
2025-06-24,"Rezolve Ai Achieves $70 Mln ARR, Secures Microsoft And Google Deals, Joins Russell 2000 - Nasdaq",Google
2025-06-24,British regulator takes aim at Google's dominance with 'targeted measures to address specific aspects of how Google operates' - PC Gamer,Google
2025-06-24,Protecting innovation and growth in the UK - Google Blog,Google
2025-06-24,Google Martha seems to be the new codename for Android XR smart glasses - Android Central,Google
2025-06-19,Four Things I Do to Make My Google Nest Devices More Useful - Lifehacker,Google
2025-06-24,The Google Pixel 10 Pro Fold could be the first foldable to get a much-needed durability feature - TechRadar,Google
2025-06-24,6 reasons I'm finally quitting Google Photos — and what I'm replacing it with - Android Police,Google
2025-06-24,Google Brings Historical Street View Imagery to Google Earth - Thurrott.com,Google
2025-06-21,A Google engineer's advice to computer science students: Go where the hiring bar is lower and get your foot in the door - Business Insider,Google
2025-06-24,Google hands off Agent2Agent protocol to Linux Foundation for open AI agent standard - the-decoder.com,Google
2025-06-24,Google faces UK push to loosen its grip on search - Financial Times,Google
2025-06-24,Nest x Yale Lock successor has finally arrived in this $189 ‘Google Home Preferred’ lock - 9to5Google,Google
2025-06-24,UK aims to tackle Google dominance of online search - Griffin Daily News,Google
2025-06-22,When is the best time to book your flight? Google just revealed its airfare secrets - ZDNet,Google
2025-06-24,Google introduces AI mode to users in India - Yahoo Finance,Google
2025-06-24,Gemini AI Explained: A Deep Dive Into Google’s Multimodal Assistant - extremetech.com,Google
2025-06-23,Google Adds Multi-Layered Defenses to Secure GenAI from Prompt Injection Attacks - The Hacker News,Google
2025-06-24,Android’s youthful new design will change the way you make and answer calls - The Verge,Google
2025-06-24,"We Want Fair Competition, UK Moves to Alter Monopolised Google Search Rankings - Impakter",Google
2025-06-24,Britain will search in vain for ways to hobble Google - Financial Times,Google
2025-06-24,Which of these two affordable Android phones deserves your attention more? - Android Central,Google
2025-06-24,Google finally makes Chrome's bottom address bar official on Android - Android Police,Google
2025-06-21,"Billions of login credentials have been leaked online, Cybernews researchers say - AP News",Google
2025-06-23,ChatGPT's Impact On Our Brains According to an MIT Study - Time Magazine,Google
2025-06-24,Google AI Mode suggesting prompts based on your past searches - 9to5Google,Google
2025-06-24,Google could make an ambitious 2nm jump for the Tensor G6 - Android Police,Google
2025-06-20,"Google, Apple, Meta Passwords Exposed in Massive Hack: Report - Entrepreneur",Google
2025-06-17,We’re expanding our Gemini 2.5 family of models - Google Blog,Google
2025-06-23,Ask a techspert: What is inference? - Google Blog,Google
2025-06-24,"Pixel 11’s Tensor G6 will reportedly use 2nm process at TSMC, no longer lagging behind - 9to5Google",Google
2025-06-19,Google looks likely to lose appeal against record $4.7 billion EU fine - CNBC,Google
2025-06-22,"Were 16 billion passwords from Apple, Google, and Facebook leaked? How to protect yourself - ZDNet",Google
2025-06-24,"The Google Pixel Watch 3 isn't for me, but these great smartwatches are - Android Central",Google
2025-06-24,Amazon bringing faster delivery to thousands of small towns and cities - CNBC,Amazon
2025-06-24,"Amazon’s bringing faster Prime delivery speeds to thousands of smaller cities, towns, and rural communities - AboutAmazon.com",Amazon
2025-06-24,"More rural communities to get same-day, next-day Amazon delivery: See where - USA Today",Amazon
2025-06-24,"The First James Bond of the Amazon Era Is Young, Reckless, and a Playable Character - The Hollywood Reporter",Amazon
2025-06-24,"Amazon Orders 350,000 Employees To Relocate Or Resign Without Severance - MSN",Amazon
2025-06-24,"Amazon Prime Day 2025: The best early deals already live, dates and everything else you need to know - Engadget",Amazon
2025-06-23,"According to Amazon Shoppers, the Best Bathing Suit for Summer Is Actually This $39 Swim Dress - People.com",Amazon
2025-06-23,"Amazon Is Selling a 'Flattering' $35 Maxi Dress for Just $17, and Shoppers Say It’s 'Great for Summer’ - parade.com",Amazon
2025-06-23,The Best Summer Dresses on Amazon Under $50 - NBC News,Amazon
2025-06-24,15 Amazon Travel Outfits With Cooling Fabrics That’ll Keep You Comfy on the Hottest Summer Days—From $20 - Travel + Leisure,Amazon
2025-06-23,Amazon’s New James Bond - The New Yorker,Amazon
2025-06-24,Amazon is selling a 'stylish' $160 smartwatch for just $35 that shoppers say 'is like having a personal assistant' - TheStreet,Amazon
2025-06-24,"At Amazon’s Biggest Data Center, Everything Is Supersized for A.I. - The New York Times",Amazon
2025-06-24,Amazon’s Fire TV Stick 4K drops to its best price of the year - PCWorld,Amazon
2025-06-24,"Amazon Fresh closes Federal Way store, lays off 125 employees - MyNorthwest.com",Amazon
2025-06-24,Amazon closes Fresh grocery store south of Seattle; state filing says 125 workers impacted - GeekWire,Amazon
2025-06-24,Amazon to invest $54 billion in Britain over next three years - Reuters,Amazon
2025-06-24,Amazon Expands Prime Delivery Services Across Rural U.S. - WSJ,Amazon
2025-06-24,Amazon is dropping way better early Prime Day TV deals than years prior - Mashable,Amazon
2025-06-24,Amazon closes Federal Way grocery store - The Seattle Times,Amazon
2025-06-24,Early Amazon Prime Day deals are live from $6 — here’s the 45 sales I'd shop now - Tom's Guide,Amazon
2025-06-24,Amazon begins expanding same-day delivery to rural customers - Chain Store Age,Amazon
2025-06-24,‘House of David’ Producer Wonder Project to Launch Subscription Offering on Amazon in Fall 2025 - Variety,Amazon
2025-06-24,Amazon aims to reach 'tens of millions' more small town and rural customers with same-day delivery - GeekWire,Amazon
2025-06-24,"Amazon to expand Prime delivery services in smaller cities, rural areas in US by year end - Reuters",Amazon
2025-06-24,Amazon to spend over $4B to expand Prime delivery to rural communities in the US - TechCrunch,Amazon
2025-06-24,Amazon aims to speed up delivery to 4K rural communities by end of year - Retail Dive,Amazon
2025-06-24,Amazon gets extended deadline to build next phase of HQ2 - ARLnow,Amazon
2025-06-24,My Favorite Amazon Deal of the Day: This AOSU Solar Camera - Lifehacker,Amazon
2025-06-24,How SkillShow automates youth sports video processing using Amazon Transcribe - Amazon.com,Amazon
2025-06-24,‘Bloodaxe’ Viking Series at Amazon Casts Xavier Molyneux in Lead Role - Variety,Amazon
2025-06-24,"Amazon is expanding same-day delivery to 4,000 small towns - Quartz",Amazon
2025-06-24,"Amazon fast-delivery expansion to reach 4,000 rural communities in 2025 - FreightWaves",Amazon
2025-06-24,Costco makes a bold move to compete with Amazon - TheStreet,Amazon
2025-06-24,Olipop turns fans into influencers for pennies with PR boxes on Amazon - Marketing Dive,Amazon
2025-06-24,"Amazon Takes $150 Off M4 MacBook Air, Starting at $849 - MacRumors",Amazon
2025-06-24,Amazon announces plan to invest $54 billion into the U.K. - upi.com,Amazon
2025-06-24,Saving Money by Ordering Car Parts from Amazon or eBay - Economist Writing Every Day,Amazon
2025-06-24,My Dad Has Grilled Everything for Over 40 Years — These Are His Summer Cooking Tools All Under $25 - Food & Wine,Amazon
2025-06-24,Amazon Changing Prime Delivery Nationwide: What to Know - Newsweek,Amazon
2025-06-23,Amazon’s premium beauty push may be a buffer against Trump's tariffs - Reuters,Amazon
2025-06-24,Too hot to sleep? Shoppers say this $60 Amazon cooling blanket is 'worth every penny' and 'keeps you very cool' - Yahoo,Amazon
2025-06-24,Amazon’s big AI upgrade is hilariously bad - TheStreet,Amazon
2025-06-24,"Wheel unveils medication fulfillment, delivery model backed by Amazon Pharmacy - MobiHealthNews",Amazon
2025-06-24,Amazon expands next day delivery to more rural communities - upi.com,Amazon
2025-06-24,Amazon.com remains top internet idea at JPMorgan - Yahoo Finance,Amazon
2025-06-23,"Amazon Prime Day 2025: The Best Early Offers, According To Deal Experts - Forbes",Amazon
2025-06-24,11 Petite Summer Dresses That Will Make You Look Taller—All Under $40 At Amazon - Southern Living,Amazon
2025-06-24,5 Chic Summer Trends I’m Shopping on Sale at Amazon - Glamour,Amazon
2025-06-24,‘House of David’ Studio Wonder Project Is Launching Its Own SVOD Service on Amazon Prime Video - The Hollywood Reporter,Amazon
2025-06-24,"Checking claims undocumented immigrants paid more taxes than Amazon, GM, IBM and Netflix combined - Snopes",Amazon
2025-06-24,"Amazon to Invest Around $54 Billion in U.K. to Support Innovation, AI Push - WSJ",Amazon
2025-06-24,"Amazon is selling a $570 smart projector for only $260, and reviewers say it 'beats a large TV' on movie nights - TheStreet",Amazon
2025-06-23,Amazon Prime Day is July 8-11: Here's everything to know - ZDNet,Amazon
2025-06-23,No packages inside Amazon van that caught fire inside Ted Williams Tunnel - WCVB,Amazon
2025-06-24,Verizon Giving Out Free Amazon Gift Cards - Droid Life,Amazon
2025-06-24,MercadoLibre Stock: Amazon Rival And Cathie Wood Stock Soars 44%. Strong Crypto Outlook Lends Wings - Investor's Business Daily,Amazon
2025-06-24,"Amazon is selling a 'durable' $1,000 15.6-inch laptop for $500, and shoppers say its 'speed is perfect' - TheStreet",Amazon
2025-06-24,Amazon Prime Video to have Wonder Project’s faith-focused channel in US this fall By Reuters - Investing.com,Amazon
2025-06-24,Amazon To Invest $4 Bln To Expand Speed Delivery To Rural Communities Across U.S - Nasdaq,Amazon
2025-06-24,Amazon to invest £40 billion in the UK over next three years - CNBC,Amazon
2025-06-24,"Walmart, Target announce July sales overlapping Amazon Prime Day - Houston Chronicle",Amazon
2025-06-24,Bezos beams up batch two as Project Kuiper plays catch-up with Starlink - theregister.com,Amazon
2025-06-23,Amazon truck catches fire in Ted Williams Tunnel - Boston 25 News,Amazon
2025-06-22,Americans Will Put Money In Amazon And Walmart Stablecoins - Forbes,Amazon
2025-06-24,"Dow's 483-point rally led by gains in Salesforce, Amazon.com Inc. shares - MSN",Amazon
2025-06-23,Electric Boats Offer a More Eco-Friendly Way to Travel in the Amazon - The New York Times,Amazon
2025-06-24,"Amazon Plans to Invest Nearly $55B in UK, Expanding AI Infrastructure - Yahoo Finance",Amazon
2025-06-24,Amazon is selling a 'quality' $895 Bulova watch for $492 that 'gets more compliments' than an 'Omega Seamaster' - TheStreet,Amazon
2025-06-24,Bezos' Venice wedding party moved to isolated area on security concerns - Reuters,Amazon
2025-06-24,Slide your MacBook tomtoc’s Flap Backpack while four colorways are down to $70 at Amazon - 9to5Toys,Amazon
2025-06-24,Amazon building 30 data centers in Indiana running its custom chips to power Anthropic AI - Sherwood News,Amazon
2025-06-24,What's Going On With Amazon Stock Today? - Benzinga,Amazon
2025-06-24,"Amazon is selling a 'sleek and lightweight' $1,500 laptop for only $359, and shoppers say it's a 'beast' - TheStreet",Amazon
2025-06-24,Amazon has an ‘impressive’ art TV on sale for under $600 — but this deal ends sooner than you think - NJ.com,Amazon
2025-06-24,Whoa! Amazon just slashed $130 off one of my all-time favorite gaming monitors - Tom's Guide,Amazon
2025-06-24,"NVIDIA Corp., Amazon.com Inc. share gains lead Dow's 363-point climb - MSN",Amazon
2025-06-21,"Easy returns cause big trouble for Amazon sellers, but return rates show signs of slowing - CNBC",Amazon
2025-06-21,Dad shares an 'Amazon product review' of his newborn baby and it's parody perfection - Upworthy,Amazon
2025-06-24,"Shark's Misting Pedestal Fan Is $50 Off on Amazon Right Now, and Even Texans Say It Helps Them Beat the Heat - Men's Journal",Amazon
2025-06-18,5 Amazon AI tools that can help you save time and money this Prime Day - AboutAmazon.com,Amazon
2025-06-24,"LiDAR Technology Unveils 2,500-Year-Old Hidden Cities in the Amazon - The Daily Galaxy",Amazon
2025-06-24,"Early Prime Day Lego sale at Amazon — 17 deals I’d shop from $7 on Botanicals, Lego Star Wars and more - Tom's Guide",Amazon
2025-06-24,Amazon expanding same-day Prime delivery services for small-town USA - Cybernews,Amazon
2025-06-23,Atlas V rocket launches 2nd batch of satellites for Amazon's Project Kuiper megaconstellation (video) - Space,Amazon
2025-06-24,Amazon E-Bike Lawsuit Alleges Defective Foldable Design Caused Paralyzation - AboutLawsuits.com,Amazon
2025-06-20,UK grocery watchdog probes Amazon over alleged supplier payment delays - Reuters,Amazon
2025-06-24,Score $100 off the Shark FlexStyle right now on Amazon for salon hair - New York Post,Amazon
2025-06-24,Early Hurricane Season: Generator Sales On Amazon - The Weather Channel,Amazon
2025-06-23,Amazon delivery van catches fire in Boston's Ted Williams Tunnel - NBC Boston,Amazon
2025-06-24,"Amazon projects in jeopardy as Brazilian prosecutors challenge mining permits, O&G auction results - BNamericas",Amazon
2025-06-17,Message from CEO Andy Jassy: Some thoughts on Generative AI - AboutAmazon.com,Amazon
2025-06-24,Amazon’s Bestselling Military & Tactical Boots Are on Sale for Only $44 - Athlon Sports,Amazon
2025-06-23,"Amazon launches second batch of Kuiper internet satellites, taking on Elon Musk's Starlink - CNBC",Amazon
2025-06-24,Amazon Fills Rural Delivery Gap Increasingly Left by USPS - EcommerceBytes,Amazon
2025-06-24,"Amazon Is Selling an Ego String Trimmer Bundle for Almost 50% Off, and Shoppers Say It 'Cuts Through Anything' - Men's Journal",Amazon
2025-06-23,Amazon Worker Fears Deportation After Humanitarian Parole Revoked - Newsweek,Amazon
2025-06-23,"Top Stock Reports for Amazon.com, Home Depot & Cisco Systems - Yahoo Finance",Amazon
2025-06-20,Amazon Tells Thousands of Employees to Relocate or Resign - Entrepreneur,Amazon
2025-06-23,"Early Prime Day Deals on Apple AirPods, iPads, Smartwatches, and More - PCMag",Amazon
2025-06-20,Brazil's soy farmers raze Amazon rainforest despite deforestation pact - Reuters,Amazon
